{
  "$schema": "https://json-schema.org/draft/2020-12/schema",
  "$id": "https://livingcontext.dev/schema/context/v0.1.0",
  "title": "LCDD Context",
  "description": "A Living Context — the atomic unit of governance in LCDD.",
  "type": "object",
  "required": ["id", "version", "title", "description", "source", "authority", "lifecycle", "governance"],
  "properties": {
    "id": {
      "type": "string",
      "pattern": "^[a-zA-Z0-9_-]+$",
      "maxLength": 128
    },
    "version": {
      "type": "integer",
      "minimum": 1
    },
    "created_at": {
      "type": "string",
      "format": "date-time"
    },
    "updated_at": {
      "type": "string",
      "format": "date-time"
    },
    "title": {
      "type": "string",
      "minLength": 1,
      "maxLength": 256
    },
    "description": {
      "type": "string",
      "minLength": 1,
      "maxLength": 16384
    },
    "source": {
      "type": "object",
      "required": ["type"],
      "properties": {
        "type": {
          "type": "string",
          "enum": ["individual", "organization", "standard-body", "ai-system", "community", "automated", "regulatory", "documentation", "meeting", "incident", "unknown"]
        },
        "uri": {
          "type": "string",
          "format": "uri"
        },
        "document_id": {
          "type": "string"
        },
        "location": {
          "type": "string"
        },
        "extraction_method": {
          "type": "string",
          "enum": ["manual", "llm", "regex", "api", "unknown"]
        },
        "confidence": {
          "type": "number",
          "minimum": 0,
          "maximum": 1
        }
      }
    },
    "authority": {
      "type": "object",
      "required": ["source", "level"],
      "properties": {
        "source": {
          "type": "object",
          "required": ["type", "id", "name"],
          "properties": {
            "type": {
              "type": "string",
              "enum": ["individual", "organization", "standard-body", "ai-system", "community", "automated"]
            },
            "id": { "type": "string" },
            "name": { "type": "string" },
            "uri": { "type": "string", "format": "uri" }
          }
        },
        "level": {
          "type": "integer",
          "minimum": 0,
          "maximum": 4
        },
        "delegation": {
          "type": "array",
          "items": {
            "type": "object",
            "required": ["from", "to", "scope", "effective_date"],
            "properties": {
              "from": { "type": "string" },
              "to": { "type": "string" },
              "scope": { "type": "string" },
              "effective_date": { "type": "string", "format": "date" },
              "expiration": { "type": ["string", "null"], "format": "date" }
            }
          }
        },
        "trust_model": {
          "type": "string",
          "enum": ["direct", "delegated", "community-consensus", "ai-inferred"]
        },
        "trust_score": {
          "type": "number",
          "minimum": 0,
          "maximum": 1
        },
        "challenge_policy": {
          "type": "object",
          "properties": {
            "process": { "type": "string" },
            "uri": { "type": "string", "format": "uri" },
            "sla_hours": { "type": "integer", "minimum": 0 }
          }
        }
      }
    },
    "category": {
      "type": "string"
    },
    "severity": {
      "type": "string",
      "enum": ["critical", "high", "medium", "low", "info"]
    },
    "applies_to": {
      "type": "array",
      "items": { "type": "string" },
      "minItems": 1,
      "default": ["**/*"]
    },
    "lifecycle": {
      "type": "string",
      "enum": ["draft", "candidate", "approved", "active", "deprecated", "archived"]
    },
    "governance": {
      "type": "object",
      "required": ["classification", "approval_required"],
      "properties": {
        "classification": {
          "type": "string",
          "enum": ["hardened-mandate", "hardened-standard", "hardened-local", "local-standard", "local-guideline", "local-experimental"]
        },
        "approval_required": {
          "type": "boolean"
        },
        "approvers": {
          "type": "array",
          "items": { "type": "string" }
        },
        "min_review_period_hours": {
          "type": "integer",
          "minimum": 0
        }
      }
    },
    "effective_date": {
      "type": ["string", "null"],
      "format": "date-time"
    },
    "deprecated_date": {
      "type": ["string", "null"],
      "format": "date-time"
    },
    "owner": {
      "type": "string"
    },
    "review_status": {
      "type": "string",
      "enum": ["pending", "in-review", "approved", "rejected", "needs-revision"]
    },
    "enforcement": {
      "type": "object",
      "properties": {
        "mode": {
          "type": "string",
          "enum": ["block", "warn", "comment", "silent"]
        },
        "specification": {
          "type": "object",
          "required": ["type"],
          "properties": {
            "type": { "type": "string" },
            "config": { "type": "object" },
            "violation_message_template": { "type": "string" }
          }
        }
      }
    },
    "evidence": {
      "type": "array",
      "items": {
        "type": "object",
        "properties": {
          "type": { "type": "string" },
          "uri": { "type": "string", "format": "uri" },
          "description": { "type": "string" }
        }
      }
    },
    "tags": {
      "type": "array",
      "items": { "type": "string" },
      "uniqueItems": true
    },
    "supersedes": {
      "type": "array",
      "items": { "type": "string" }
    },
    "superseded_by": {
      "type": "array",
      "items": { "type": "string" }
    },
    "metadata": {
      "type": "object",
      "additionalProperties": true
    }
  }
}
